{
  "timestamp": "2026-03-29T17:45:20.500Z",
  "latitude": 44.9542,
  "longitude": -93.0905,
  "speed": 13.1,
  "accel_rms": 1.88,
  "jerk": 0.47,
  "vibration_energy": 0.0034,
  "device_id": "ORV-003",
  "vehicle_type": "scooter",
  "imu_model": "ICM-42688-P",
  "firmware_version": "2.0.1",
  "sampling_rate_hz": 200,
  "hdop": 0.9,
  "gps_lost": false,
  "notes": "Full optional-field example for validator testing",
  "session_id": "SESSION-20260329-01",
  "operator_id": "OP-17",
  "battery_voltage": 11.7,
  "temperature_c": 22.4
}
